1,MOVIE, Toy Story, 81 min, G,"Tom Hanks, Tim Allen, Don Rickles And Others",http://ia.media-imdb.com/images/M/MV5BMTgwMjI4MzU5N15BMl5BanBnXkFtZTcwMTMyNTk3OA@@._V1_SX640_SY720_.jpg,https://www.youtube.com/watch?v=KYz2wyBy3kc,A cowboy doll is profoundly threatened and jealous when a new spaceman figure supplants him as top toy in a boy's room., Animation | Adventure | Comedy | Family | Fantasy,John Lasseter,1995,,
2,MOVIE,Avatar, 162 min,PG-13,"Sam Worthington, Zoe Saldana, Sigourney Weaver","http://ia.media-imdb.com/images/M/MV5BMTYwOTEwNjAzMl5BMl5BanBnXkFtZTcwODc5MTUwMw@@._V1_SY317_CR0,0,214,317_AL_.jpg",http://www.youtube.com/watch?v=5PSNL1qE6VY,A Paraplegic Marine dispatched to the moon Pandora on a unique mission becomes torn between following his orders and protecting the world he feels is his home, Action | Adventure | Fantasy | Sci-Fi, James Cameron,2009,,
3,TVSHOW, Arrow, 42 min,TV-14," Stephen Amell, Katie Cassidy, David Ramsey",http://ia.media-imdb.com/images/M/MV5BMTg3OTc0NzkyOV5BMl5BanBnXkFtZTgwMDMwMTM3MjE@._V1_SX214_AL_.jpg,www.youtube.com/watch?v=hx-J8TG8jLQ,Spoiled billionaire playboy Oliver Queen is missing and presumed dead when his yacht is lost at sea. He returns five years later a changed man  determined to clean up the city as a hooded vigilante armed with a bow., Action | Adventure | Crime | Drama | Mystery | Sci-Fi," Greg Berlanti , Marc Guggenheim Andrew Kreisberg",2012,40,4
4,MOVIE,Independence Day,145 min,PG-13," Will Smith, Bill Pullman, Jeff Goldblum","http://ia.media-imdb.com/images/M/MV5BMTMwODY3NzQzNF5BMl5BanBnXkFtZTcwNzUxNjc0MQ@@._V1_SY317_CR6,0,214,317_AL_.jpg","www.youtube.com/watch?v=UqNRkA0Zq3Q
","The aliens are coming and their goal is to invade and destroy Earth. Fighting superior technology, mankind's best weapon is the will to survive.",Action | Adventure | Sci-Fi, Roland Emmerich,1996,,
5,TVSHOW,Agents of S.H.I.E.L.D.,45 min,TV-PG," Clark Gregg, Ming-Na Wen, Brett Dalton",http://ia.media-imdb.com/images/M/MV5BMTkwODYyMjgzOV5BMl5BanBnXkFtZTgwODAzMTE5MjE@._V1_SX214_AL_.jpg,www.youtube.com/watch?v=PerIAuv27SQ,"After the Battle of New York, the world has changed. It now knows not only about the Avengers, but also the powerful menaces that require those superheroes and more to face them. In response, Phil Coulson of the Strategic Homeland Intervention, Enforcement and Logistics Division assembles an elite covert team to find and deal with these threats wherever they are found. With a world rapidly becoming more bizarre and dangerous than ever before as the supervillains arise, these agents of S.H.I.E.L.D. are ready to take them on",Action | Drama | Sci-Fi,"
 Maurissa Tancharoen, Jed Whedon, Joss Whedon",2003,66,3
6,TVSHOW,The Blacklist,43 min,TV-14,"James Spader, Megan Boone, Diego Klattenhoff","http://ia.media-imdb.com/images/M/MV5BNTk2ODQzOTY4N15BMl5BanBnXkFtZTgwNjkwMjQ3MjE@._V1_SY317_CR1,0,214,317_AL_.jpg",https://www.youtube.com/watch?v=BehCExCEeGU,"Elizabeth 'Liz' Keen, a new FBI profiler has her entire life uprooted when a mysterious criminal, Raymond Reddington, on the FBI's Top Ten Most Wanted List turns himself in and insists on speaking to her.","Crime, Drama, Mystery",Jon Bokenkamp,2013,66,3
